{
  "version": "v1",
  "category_catalog": [
    {
      "category": "primitive",
      "kind": "structural",
      "owner_key": "primitive-detection",
      "oracle_strategy": "boundary-fixture",
      "required_layers": [
        "rule-contract",
        "owner-route",
        "must-report",
        "must-not-report"
      ]
    },
    {
      "category": "missing-validate",
      "kind": "structural",
      "owner_key": "type-method-contract",
      "oracle_strategy": "boundary-fixture",
      "required_layers": [
        "rule-contract",
        "owner-route",
        "must-report",
        "must-not-report"
      ]
    },
    {
      "category": "missing-stringer",
      "kind": "structural",
      "owner_key": "type-method-contract",
      "oracle_strategy": "boundary-fixture",
      "required_layers": [
        "rule-contract",
        "owner-route",
        "must-report",
        "must-not-report"
      ]
    },
    {
      "category": "missing-constructor",
      "kind": "structural",
      "owner_key": "constructor-shape",
      "oracle_strategy": "boundary-fixture",
      "required_layers": [
        "rule-contract",
        "owner-route",
        "must-report",
        "must-not-report"
      ]
    },
    {
      "category": "wrong-constructor-sig",
      "kind": "structural",
      "owner_key": "constructor-shape",
      "oracle_strategy": "boundary-fixture",
      "required_layers": [
        "rule-contract",
        "owner-route",
        "must-report",
        "must-not-report"
      ]
    },
    {
      "category": "missing-func-options",
      "kind": "structural",
      "owner_key": "constructor-shape",
      "oracle_strategy": "boundary-fixture",
      "required_layers": [
        "rule-contract",
        "owner-route",
        "must-report",
        "must-not-report"
      ]
    },
    {
      "category": "missing-immutability",
      "kind": "structural",
      "owner_key": "constructor-shape",
      "oracle_strategy": "boundary-fixture",
      "required_layers": [
        "rule-contract",
        "owner-route",
        "must-report",
        "must-not-report"
      ]
    },
    {
      "category": "wrong-validate-sig",
      "kind": "structural",
      "owner_key": "type-method-contract",
      "oracle_strategy": "boundary-fixture",
      "required_layers": [
        "rule-contract",
        "owner-route",
        "must-report",
        "must-not-report"
      ]
    },
    {
      "category": "wrong-stringer-sig",
      "kind": "structural",
      "owner_key": "type-method-contract",
      "oracle_strategy": "boundary-fixture",
      "required_layers": [
        "rule-contract",
        "owner-route",
        "must-report",
        "must-not-report"
      ]
    },
    {
      "category": "missing-struct-validate",
      "kind": "structural",
      "owner_key": "constructor-shape",
      "oracle_strategy": "boundary-fixture",
      "required_layers": [
        "rule-contract",
        "owner-route",
        "must-report",
        "must-not-report"
      ]
    },
    {
      "category": "wrong-struct-validate-sig",
      "kind": "structural",
      "owner_key": "constructor-shape",
      "oracle_strategy": "boundary-fixture",
      "required_layers": [
        "rule-contract",
        "owner-route",
        "must-report",
        "must-not-report"
      ]
    },
    {
      "category": "unvalidated-cast",
      "kind": "protocol",
      "owner_key": "protocol-cfa",
      "oracle_strategy": "layered-protocol",
      "required_layers": [
        "rule-contract",
        "owner-route",
        "must-report",
        "must-not-report",
        "must-be-inconclusive",
        "production-integration",
        "generated",
        "metamorphic",
        "fuzz",
        "mutation",
        "determinism"
      ]
    },
    {
      "category": "unvalidated-cast-inconclusive",
      "kind": "protocol",
      "owner_key": "protocol-cfa",
      "oracle_strategy": "layered-protocol",
      "required_layers": [
        "rule-contract",
        "owner-route",
        "must-report",
        "must-not-report",
        "must-be-inconclusive",
        "production-integration",
        "generated",
        "metamorphic",
        "fuzz",
        "mutation",
        "determinism"
      ]
    },
    {
      "category": "unused-validate-result",
      "kind": "structural",
      "owner_key": "validate-result-usage",
      "oracle_strategy": "boundary-fixture",
      "required_layers": [
        "rule-contract",
        "owner-route",
        "must-report",
        "must-not-report"
      ]
    },
    {
      "category": "unused-constructor-error",
      "kind": "structural",
      "owner_key": "constructor-error-usage",
      "oracle_strategy": "boundary-fixture",
      "required_layers": [
        "rule-contract",
        "owner-route",
        "must-report",
        "must-not-report"
      ]
    },
    {
      "category": "missing-constructor-validate",
      "kind": "protocol",
      "owner_key": "constructor-validation",
      "oracle_strategy": "layered-protocol",
      "required_layers": [
        "rule-contract",
        "owner-route",
        "must-report",
        "must-not-report",
        "must-be-inconclusive",
        "production-integration",
        "generated",
        "metamorphic",
        "fuzz",
        "mutation",
        "determinism"
      ]
    },
    {
      "category": "missing-constructor-validate-inconclusive",
      "kind": "protocol",
      "owner_key": "constructor-validation",
      "oracle_strategy": "layered-protocol",
      "required_layers": [
        "rule-contract",
        "owner-route",
        "must-report",
        "must-not-report",
        "must-be-inconclusive",
        "production-integration",
        "generated",
        "metamorphic",
        "fuzz",
        "mutation",
        "determinism"
      ]
    },
    {
      "category": "incomplete-validate-delegation",
      "kind": "structural",
      "owner_key": "validate-delegation",
      "oracle_strategy": "boundary-fixture",
      "required_layers": [
        "rule-contract",
        "owner-route",
        "must-report",
        "must-not-report"
      ]
    },
    {
      "category": "nonzero-value-field",
      "kind": "structural",
      "owner_key": "nonzero-field",
      "oracle_strategy": "boundary-fixture",
      "required_layers": [
        "rule-contract",
        "owner-route",
        "must-report",
        "must-not-report"
      ]
    },
    {
      "category": "wrong-func-option-type",
      "kind": "structural",
      "owner_key": "constructor-shape",
      "oracle_strategy": "boundary-fixture",
      "required_layers": [
        "rule-contract",
        "owner-route",
        "must-report",
        "must-not-report"
      ]
    },
    {
      "category": "enum-cue-missing-go",
      "kind": "cross-artifact",
      "owner_key": "enum-cue-sync",
      "oracle_strategy": "artifact-parity",
      "required_layers": [
        "rule-contract",
        "owner-route",
        "must-report",
        "must-not-report",
        "artifact-parity"
      ]
    },
    {
      "category": "enum-cue-extra-go",
      "kind": "cross-artifact",
      "owner_key": "enum-cue-sync",
      "oracle_strategy": "artifact-parity",
      "required_layers": [
        "rule-contract",
        "owner-route",
        "must-report",
        "must-not-report",
        "artifact-parity"
      ]
    },
    {
      "category": "use-before-validate-same-block",
      "kind": "protocol",
      "owner_key": "protocol-cfa",
      "oracle_strategy": "layered-protocol",
      "required_layers": [
        "rule-contract",
        "owner-route",
        "must-report",
        "must-not-report",
        "must-be-inconclusive",
        "production-integration",
        "generated",
        "metamorphic",
        "fuzz",
        "mutation",
        "determinism"
      ]
    },
    {
      "category": "use-before-validate-cross-block",
      "kind": "protocol",
      "owner_key": "protocol-cfa",
      "oracle_strategy": "layered-protocol",
      "required_layers": [
        "rule-contract",
        "owner-route",
        "must-report",
        "must-not-report",
        "must-be-inconclusive",
        "production-integration",
        "generated",
        "metamorphic",
        "fuzz",
        "mutation",
        "determinism"
      ]
    },
    {
      "category": "use-before-validate-inconclusive",
      "kind": "protocol",
      "owner_key": "protocol-cfa",
      "oracle_strategy": "layered-protocol",
      "required_layers": [
        "rule-contract",
        "owner-route",
        "must-report",
        "must-not-report",
        "must-be-inconclusive",
        "production-integration",
        "generated",
        "metamorphic",
        "fuzz",
        "mutation",
        "determinism"
      ]
    },
    {
      "category": "suggest-validate-all",
      "kind": "structural",
      "owner_key": "validate-delegation",
      "oracle_strategy": "boundary-fixture",
      "required_layers": [
        "rule-contract",
        "owner-route",
        "must-report",
        "must-not-report"
      ]
    },
    {
      "category": "missing-constructor-error-return",
      "kind": "structural",
      "owner_key": "constructor-shape",
      "oracle_strategy": "boundary-fixture",
      "required_layers": [
        "rule-contract",
        "owner-route",
        "must-report",
        "must-not-report"
      ]
    },
    {
      "category": "redundant-conversion",
      "kind": "structural",
      "owner_key": "redundant-conversion",
      "oracle_strategy": "boundary-fixture",
      "required_layers": [
        "rule-contract",
        "owner-route",
        "must-report",
        "must-not-report"
      ]
    },
    {
      "category": "missing-struct-validate-fields",
      "kind": "structural",
      "owner_key": "validate-delegation",
      "oracle_strategy": "boundary-fixture",
      "required_layers": [
        "rule-contract",